id,sender,receiver,subject,content,timestamp,status,read_status,attachments
2024090101234,Jamie_Wilson@mail.com,alex.rivera@example.com,"Catching Up Over Coffee","Hey Alex, Hope you're doing well! It's been a while since we caught up. How about grabbing coffee this weekend? Let me know what works for you. Cheers, Jamie",2024-09-01 09:00:00,Sent,Read,
2024090105678,echen@university.edu,Jamie_Wilson@mail.com,"Machine Learning Lecture Notes","Hi Jamie, Attached are the notes from today's lecture on machine learning algorithms. Let me know if you have any questions. Best, Dr. Chen",2024-09-01 10:30:00,Received,Unread,/documents/ML_Lecture_Notes.pdf
2024090102345,Jamie_Wilson@mail.com,sam.patel@startup.com,"Project Update and Feedback","Hi Sam, I wanted to update you on the progress of our startup project. We've developed a preliminary business model and would appreciate your feedback. Attached is the draft presentation. Looking forward to your insights. Best, Jamie",2024-09-01 14:00:00,Sent,Read,/documents/Startup_Project_Presentation.pdf
2024090106789,Jamie_Wilson@mail.com,studygroup@university.edu,"Group Project Meeting","Hi Team, Just a reminder about our meeting in the library today at 1:15 PM to work on our tech startup project. Please bring any materials you have prepared. See you there! Best, Jamie",2024-09-01 11:00:00,Sent,Read,
2024090103456,alex.rivera@example.com,Jamie_Wilson@mail.com,"Re: Catching Up Over Coffee","Hey Jamie, Coffee sounds great! How about Saturday afternoon? Let me know if that works for you. Looking forward to it! Best, Alex",2024-09-01 11:30:00,Received,Unread,
2024090107890,Jamie_Wilson@mail.com,bookstore@nyc.com,"Inquiry About New Releases","Hello, I visited your bookstore today and was interested in some of the new releases in tech and entrepreneurship. Could you please send me a list of the latest arrivals? Thank you! Best, Jamie",2024-09-01 16:00:00,Sent,Read,
2024090104567,sam.patel@startup.com,Jamie_Wilson@mail.com,"Re: Project Update and Feedback","Hi Jamie, Thanks for the update and the presentation. I'll review it and get back to you with my feedback by the end of the week. Keep up the great work! Best, Sam",2024-09-01 17:00:00,Received,Unread,
2024090108901,Jamie_Wilson@mail.com,rockclimbingclub@nyc.com,"Joining the Climbing Session","Hi, I would like to join the rock climbing session this evening at 5:30 PM. Please let me know if there are any spots available. Thanks! Best, Jamie",2024-09-01 12:00:00,Sent,Read,
2024090105679,Jamie_Wilson@mail.com,alex.rivera@example.com,"Re: Re: Catching Up Over Coffee","Hey Alex, Saturday afternoon works perfectly for me. Let's meet at our usual spot. Looking forward to it! Cheers, Jamie",2024-09-01 12:30:00,Sent,Read,
2024090109012,bookstore@nyc.com,Jamie_Wilson@mail.com,"Re: Inquiry About New Releases","Hello Jamie, Thank you for your inquiry. Attached is the list of our latest arrivals in tech and entrepreneurship. We hope to see you again soon! Best, NYC Bookstore",2024-09-01 17:30:00,Received,Unread,/documents/New_Releases_List.pdf



2024090212345,Jamie_Wilson@mail.com,alex.rivera@example.com,"Catching Up Over Dinner","Hey Alex, Hope you're doing well! I was thinking we could catch up over dinner sometime this week. Let me know your availability. Looking forward to it! Cheers, Jamie",2024-09-02 08:00:00,Sent,Read,
2024090212346,echen@university.edu,Jamie_Wilson@mail.com,"Seminar Feedback","Hi Jamie, I wanted to commend you on your active participation in today's seminar. Your insights on entrepreneurship were very valuable. Keep up the great work! Best, Dr. Chen",2024-09-02 11:15:00,Received,Unread,
2024090212347,Jamie_Wilson@mail.com,sam.patel@startup.com,"Project Collaboration Inquiry","Hi Sam, I hope this message finds you well. I am interested in collaborating on a new project related to web development. Could we schedule a call to discuss potential opportunities? Best regards, Jamie",2024-09-02 12:30:00,Sent,Read,
2024090212348,techclub@university.edu,Jamie_Wilson@mail.com,"Coding Workshop Materials","Hi Jamie, Attached are the materials from today's coding workshop. Feel free to reach out if you have any questions. Best, Tech Club",2024-09-02 13:00:00,Received,Read,/documents/coding_workshop_materials.pdf
2024090212349,Jamie_Wilson@mail.com,alex.rivera@example.com,"Rock Climbing This Weekend?","Hey Alex, Are you up for some rock climbing this weekend? Let me know if you're interested and we can plan it out. Cheers, Jamie",2024-09-02 14:00:00,Sent,Unread,
2024090212350,Jamie_Wilson@mail.com,group@techstartups.com,"Tech Startup Trends Article","Hi Team, I came across an interesting article on the latest trends in tech startups. Thought it might be useful for our upcoming presentation. I've attached it here. Best, Jamie",2024-09-02 15:00:00,Sent,Read,/documents/tech_startup_trends.pdf
2024090212351,Jamie_Wilson@mail.com,alex.rivera@example.com,"Dinner Plans Confirmation","Hey Alex, Just confirming our dinner plans for tonight. Looking forward to trying out that new international cuisine place! See you at 5 PM. Cheers, Jamie",2024-09-02 16:00:00,Sent,Read,
2024090212352,Jamie_Wilson@mail.com,echen@university.edu,"Follow-up on Seminar Notes","Hi Dr. Chen, Thank you for your feedback on today's seminar. I found the discussion on innovation particularly inspiring. I've attached my notes for your review. Best, Jamie",2024-09-02 17:00:00,Sent,Unread,/documents/seminar_notes.pdf
2024090212353,Jamie_Wilson@mail.com,alex.rivera@example.com,"Exploring NYC","Hey Alex, I had a great time exploring the city with you today. Let's do it again soon! Take care, Jamie",2024-09-02 19:00:00,Sent,Read,
2024090212354,Duolingo,Jamie_Wilson@mail.com,"Your Spanish Progress","Hola Jamie, ¡Buen trabajo! You've made great progress in your Spanish lessons this week. Keep it up! Saludos, Duolingo Team",2024-09-02 21:00:00,Received,Unread,



2024090301234,Jamie_Wilson@mail.com,alex.rivera@example.com,"Catching Up Over Coffee","Hey Alex, I hope you're doing well! It's been a while since we caught up. How about grabbing coffee this weekend? Let me know what works for you. Cheers, Jamie",2024-09-03 08:45:00,Sent,Read,
2024090305678,echen@university.edu,Jamie_Wilson@mail.com,"Project Collaboration Update","Hi Jamie, I wanted to check in on the progress of your coding project. Please send me the latest updates by the end of the week. Looking forward to seeing your work. Best, Dr. Chen",2024-09-03 09:15:00,Received,Unread,
2024090302345,Jamie_Wilson@mail.com,sam.patel@startup.com,"Startup Idea Feedback","Hi Sam, I hope you're having a great day! I've been working on a new startup idea and would love to get your feedback. Can we schedule a call this week? Thanks, Jamie",2024-09-03 11:00:00,Sent,Read,
2024090306789,Jamie_Wilson@mail.com,bookstore@nycbooks.com,"Book Inquiry","Hello, I visited your store today and found some interesting books on tech innovation. Could you please hold a copy of 'The Innovator's Dilemma' for me? I'll pick it up this weekend. Thanks, Jamie",2024-09-03 15:45:00,Sent,Read,
2024090303456,alex.rivera@example.com,Jamie_Wilson@mail.com,"Re: Catching Up Over Coffee","Hey Jamie, I'd love to catch up! How about Saturday afternoon at our usual spot? Let me know if that works. Cheers, Alex",2024-09-03 16:30:00,Received,Read,
2024090307890,Jamie_Wilson@mail.com,studygroup@university.edu,"Spanish Class Study Group","Hi everyone, I hope you're all doing well. I wanted to propose a study group session this Friday to prepare for our upcoming Spanish test. Let me know if you're interested and available. Best, Jamie",2024-09-03 17:00:00,Sent,Read,
2024090304567,Jamie_Wilson@mail.com,technews@newsletter.com,"Subscription Confirmation","Hello, I would like to confirm my subscription to your tech news newsletter. Please let me know if there's anything else you need from me. Thank you, Jamie",2024-09-03 18:00:00,Sent,Read,
2024090308901,sam.patel@startup.com,Jamie_Wilson@mail.com,"Re: Startup Idea Feedback","Hi Jamie, I'd be happy to discuss your startup idea. How about a call on Thursday afternoon? Let me know if that works for you. Best, Sam",2024-09-03 18:30:00,Received,Unread,
2024090305679,Jamie_Wilson@mail.com,alex.rivera@example.com,"Re: Re: Catching Up Over Coffee","Hey Alex, Saturday afternoon sounds perfect! Looking forward to it. See you then! Cheers, Jamie",2024-09-03 19:00:00,Sent,Read,
2024090306780,Jamie_Wilson@mail.com,echen@university.edu,"Re: Project Collaboration Update","Hi Dr. Chen, I'll have the updates ready for you by Friday. I'm excited to share the progress with you. Best, Jamie",2024-09-03 20:00:00,Sent,Read,/documents/project_update.pdf



2024090412345,Jamie_Wilson@mail.com,alex.rivera@example.com,"Collaboration on App Idea","Hey Alex, I had a great time discussing the app idea over coffee today. Let's set up a time this weekend to brainstorm more features and design elements. Looking forward to it! Cheers, Jamie",2024-09-04 11:00:00,Sent,Read,
2024090412346,echen@university.edu,Jamie_Wilson@mail.com,"Lecture Notes and Discussion","Hi Jamie, I hope you found today's lecture on data structures insightful. Please let me know if you have any questions or need further clarification on any topics. Best, Dr. Chen",2024-09-04 12:00:00,Received,Unread,
2024090412347,Jamie_Wilson@mail.com,sam.patel@startup.com,"Networking Event Insights","Hi Sam, I just attended a virtual networking event and came across some interesting insights on emerging technologies. Let's catch up soon to discuss potential collaboration opportunities. Best, Jamie",2024-09-04 15:00:00,Sent,Read,
2024090412348,Jamie_Wilson@mail.com,alex.rivera@example.com,"Weekend Rock Climbing","Hey Alex, Are you up for some rock climbing this weekend? I found a new indoor gym that looks amazing. Let me know if you're interested! Cheers, Jamie",2024-09-04 16:00:00,Sent,Read,
2024090412349,sam.patel@startup.com,Jamie_Wilson@mail.com,"Follow-up on Networking Event","Hi Jamie, Thanks for reaching out. I'd love to hear more about the insights you gained from the networking event. Let's schedule a call this week. Best, Sam",2024-09-04 17:00:00,Received,Unread,
2024090412350,Jamie_Wilson@mail.com,echen@university.edu,"Clarification on Lecture Topics","Hi Dr. Chen, Thank you for today's lecture. I have a few questions regarding the algorithm efficiency section. Could we possibly meet during your office hours this week? Best, Jamie",2024-09-04 18:00:00,Sent,Read,
2024090412351,Jamie_Wilson@mail.com,alex.rivera@example.com,"Guitar Jam Session","Hey Alex, I was thinking of having a guitar jam session this Friday evening. Let me know if you're free to join. It would be great to experiment with some new chords together. Cheers, Jamie",2024-09-04 19:00:00,Sent,Read,
2024090412352,Jamie_Wilson@mail.com,bookclub@university.edu,"Book Club Meeting","Hi everyone, Just a reminder about our book club meeting this Thursday. We'll be discussing the latest science fiction novel. Looking forward to hearing everyone's thoughts! Best, Jamie",2024-09-04 20:00:00,Sent,Read,
2024090412353,alex.rivera@example.com,Jamie_Wilson@mail.com,"Re: Weekend Rock Climbing","Hey Jamie, I'm definitely up for rock climbing this weekend! Let's finalize the details. Looking forward to it! Cheers, Alex",2024-09-04 21:00:00,Received,Unread,
2024090412354,Jamie_Wilson@mail.com,patagonia@store.com,"Inquiry about Sustainable Fashion","Hi, I'm interested in learning more about your latest sustainable fashion line. Could you provide more details on the materials used and the production process? Thanks, Jamie",2024-09-04 22:00:00,Sent,Read,



2024090512345,Jamie_Wilson@mail.com,alex.rivera@example.com,"Catch Up Over Dinner","Hey Alex, I hope you're doing well! I was thinking we could catch up over dinner sometime this week. Let me know your availability. Looking forward to it! Best, Jamie",2024-09-05 09:00:00,Sent,Read,
2024090512346,echen@university.edu,Jamie_Wilson@mail.com,"Upcoming Exam Preparation","Hi Jamie, I wanted to remind you about the upcoming computer science exam. Make sure to review the key concepts we discussed in class. Let me know if you have any questions. Best, Dr. Chen",2024-09-05 10:00:00,Received,Unread,
2024090512347,Jamie_Wilson@mail.com,sam.patel@startup.com,"Project Collaboration Update","Hi Sam, I hope this email finds you well. I wanted to update you on the progress of our project. I've been working on the interface design and would love your feedback. Let's schedule a call to discuss further. Best, Jamie",2024-09-05 11:00:00,Sent,Read,/documents/interface_design_v1.fig
2024090512348,alex.rivera@example.com,Jamie_Wilson@mail.com,"Re: Catch Up Over Dinner","Hey Jamie, Dinner sounds great! How about Thursday evening? Let me know if that works for you. Cheers, Alex",2024-09-05 12:00:00,Received,Read,
2024090512349,Jamie_Wilson@mail.com,studygroup@university.edu,"Study Group Session","Hi Team, Just a reminder about our study group session today at 1 PM in the campus library. Let's focus on the key concepts for the upcoming exam. See you there! Best, Jamie",2024-09-05 12:30:00,Sent,Read,
2024090512350,sam.patel@startup.com,Jamie_Wilson@mail.com,"Re: Project Collaboration Update","Hi Jamie, Thanks for the update. The interface design looks promising. Let's have a call tomorrow to discuss the next steps. Best, Sam",2024-09-05 13:30:00,Received,Unread,
2024090512351,Jamie_Wilson@mail.com,alex.rivera@example.com,"Re: Re: Catch Up Over Dinner","Hey Alex, Thursday works perfectly for me. Let's meet at our usual spot at 7 PM. Looking forward to it! Best, Jamie",2024-09-05 14:00:00,Sent,Read,
2024090512352,Jamie_Wilson@mail.com,echen@university.edu,"Exam Preparation Query","Hi Dr. Chen, Thank you for the reminder. I have a few questions about the exam topics. Could we possibly meet during your office hours this week? Best, Jamie",2024-09-05 15:00:00,Sent,Read,
2024090512353,Jamie_Wilson@mail.com,alex.rivera@example.com,"Live Music Event Tonight","Hey Alex, Just a reminder about the live music event tonight. Let's meet at the venue around 7:30 PM. It's going to be a great show! Best, Jamie",2024-09-05 16:00:00,Sent,Read,
2024090512354,echen@university.edu,Jamie_Wilson@mail.com,"Re: Exam Preparation Query","Hi Jamie, I'm available during my office hours on Wednesday. Feel free to drop by, and we can go over your questions. Best, Dr. Chen",2024-09-05 17:00:00,Received,Unread,


2024090600123,james.smith@email.com,Jamie_Wilson@mail.com,"Invitation: Afternoon Picnic at the Park","Dear Jamie, I hope this message finds you well. I was thinking it would be great to take a break and enjoy some fresh air. Would you be available for a picnic at the park tomorrow, September 7th, around 2:00 PM? It's a lovely way to unwind and catch up. Please let me know if you can make it or if there's a different time that works better for you. I'm looking forward to the possibility of spending some time outdoors with you. Best regards, James Smith",2024-09-06 10:00:00,Sent,Unread,
2024090601234,Jamie_Wilson@mail.com,alex.rivera@example.com,"Catching Up Over Coffee","Hey Alex, I hope you're doing well! I was thinking it would be great to catch up over coffee sometime this week. Let me know your availability. Looking forward to it! Best, Jamie",2024-09-06 08:45:00,Sent,Read,
2024090605678,echen@university.edu,Jamie_Wilson@mail.com,"Feedback on Presentation","Hi Jamie, I reviewed your presentation on innovative business models. It looks promising! Let's discuss it further during our next class. Best, Dr. Chen",2024-09-06 11:00:00,Sent,Unread,
2024090602345,Jamie_Wilson@mail.com,sam.patel@startup.com,"Project Collaboration Inquiry","Hi Sam, I hope this message finds you well. I attended a guest lecture today that sparked some ideas for our project. Could we schedule a call to discuss potential collaborations? Best, Jamie",2024-09-06 12:30:00,Sent,Read,
2024090606789,vegan.restaurant@nyc.com,Jamie_Wilson@mail.com,"Reservation Confirmation","Dear Jamie, Your reservation for lunch at our restaurant today at 12:00 PM is confirmed. We look forward to serving you. Best regards, Vegan Restaurant NYC",2024-09-06 09:00:00,Sent,Read,
2024090603456,Jamie_Wilson@mail.com,alex.rivera@example.com,"Spanish Movie Night","Hey Alex, I found a great Spanish-language film that could help with our language practice. How about a movie night this weekend? Let me know what you think. Cheers, Jamie",2024-09-06 15:45:00,Sent,Unread,
2024090607890,Jamie_Wilson@mail.com,echen@university.edu,"Follow-up on Lecture Insights","Hi Dr. Chen, Thank you for the insightful lecture today. I have a few questions about the applications of the discussed business models. Could we arrange a time to chat? Best, Jamie",2024-09-06 16:00:00,Sent,Read,
2024090604567,sam.patel@startup.com,Jamie_Wilson@mail.com,"Re: Project Collaboration Inquiry","Hi Jamie, I'd love to discuss your ideas from the lecture. How about a call tomorrow afternoon? Let me know what time works for you. Best, Sam",2024-09-06 13:00:00,Sent,Unread,
2024090608901,Jamie_Wilson@mail.com,family@wilson.com,"Dinner Plans Tonight","Hi everyone, Just a reminder about our dinner plans tonight at 5:30 PM. Looking forward to catching up with all of you! Love, Jamie",2024-09-06 17:00:00,Sent,Read,
2024090605679,bookstore@nyc.com,Jamie_Wilson@mail.com,"Order Confirmation: Science Fiction Novel","Dear Jamie, Your order for the science fiction novel has been confirmed. It will be delivered to your address by tomorrow. Thank you for shopping with us! Best, NYC Bookstore",2024-09-06 14:00:00,Sent,Read,
2024090609012,Jamie_Wilson@mail.com,alex.rivera@example.com,"Guitar Jam Session","Hey Alex, I was thinking of having a guitar jam session this weekend. Let me know if you're interested and we can set a time. Cheers, Jamie",2024-09-06 19:30:00,Sent,Unread,



2024090701234,Jamie_Wilson@mail.com,alex.rivera@example.com,"Movie Night Plans","Hey Alex, Looking forward to our movie night later! Let me know if there's any change in plans. See you at the theater! Cheers, Jamie",2024-09-07 12:00:00,Sent,Read,
2024090705678,echen@university.edu,Jamie_Wilson@mail.com,"Project Collaboration","Hi Jamie, I wanted to remind you about the upcoming deadline for our project. Please ensure your part is ready by next week. Let me know if you need any assistance. Best, Dr. Chen",2024-09-07 09:30:00,Sent,Unread,
2024090702345,Jamie_Wilson@mail.com,sam.patel@startup.com,"Hackathon Insights","Hi Sam, I just finished a hackathon and got some great insights on emerging tech trends. Let's catch up soon to discuss how we can incorporate these into our projects. Best, Jamie",2024-09-07 13:00:00,Sent,Read,
2024090706789,alex.rivera@example.com,Jamie_Wilson@mail.com,"Re: Movie Night Plans","Hey Jamie, All set for tonight! I'll meet you at the theater at 7 PM. Can't wait! Cheers, Alex",2024-09-07 14:00:00,Sent,Read,
2024090703456,Jamie_Wilson@mail.com,echen@university.edu,"Re: Project Collaboration","Hi Dr. Chen, Thanks for the reminder. I'm on track with my part of the project and will have it ready by the deadline. I'll reach out if I need any help. Best, Jamie",2024-09-07 10:00:00,Sent,Read,
2024090707890,sam.patel@startup.com,Jamie_Wilson@mail.com,"Re: Hackathon Insights","Hi Jamie, Sounds exciting! Let's schedule a call next week to dive into those insights. Looking forward to it. Best, Sam",2024-09-07 15:00:00,Sent,Unread,
2024090704567,Jamie_Wilson@mail.com,alex.rivera@example.com,"Guitar Jam Session","Hey Alex, How about a guitar jam session this weekend? Let me know when you're free. Cheers, Jamie",2024-09-07 16:00:00,Sent,Read,
2024090708901,Jamie_Wilson@mail.com,technews@newsletter.com,"Subscription Confirmation","Hi, Please confirm my subscription to the tech news newsletter. Looking forward to staying updated on the latest trends. Thanks, Jamie",2024-09-07 08:00:00,Sent,Read,
2024090705679,Jamie_Wilson@mail.com,bookclub@community.com,"Book Club Meeting","Hi everyone, Just a reminder about our book club meeting next week. Looking forward to discussing the latest read! Best, Jamie",2024-09-07 11:00:00,Sent,Read,
2024090706780,Jamie_Wilson@mail.com,alex.rivera@example.com,"Exploring NYC","Hey Alex, Let's explore some new neighborhoods in NYC this weekend. I've heard about some cool cafes we should check out. Let me know if you're in! Cheers, Jamie",2024-09-07 17:00:00,Sent,Read,


2024090809001,info@environmentalchampions.org,Jamie_Wilson@mail.com,"Reminder & Confirmation: Your Scheduled Speech on Environmental Awareness","Dear Jamie Wilson,I trust this message finds you well. As part of our ongoing commitment to environmental education, the Environmental Champions are excited to have you as our guest speaker at our upcoming event. This is a gentle reminder that your speech is scheduled for September 8th at 2:00 PM in the afternoon. We are reaching out to confirm your availability and to ensure that everything is set for your presentation. Your expertise and insights on environmental awareness are highly anticipated by our community. Should there be any changes to your plans or if you foresee any issues that might affect your participation, please do not hesitate to inform us at your earliest convenience. Your prompt response will help us to make any necessary adjustments. Please respond to this email to confirm your attendance or to communicate any updates. We appreciate your dedication to this cause and look forward to a fruitful event. Best regards, Linda Martin Event Coordinator Environmental Champions Phone: +1 (234) 567-8901 Email: linda.martin@environmentalchampions.org",2024-09-08 00:00:00,Sent,Unread,
2024090801234,Jamie_Wilson@mail.com,alex.rivera@example.com,"Catching Up Over Coffee","Hey Alex, I hope you're doing well! It's been a while since we caught up. How about grabbing coffee this weekend? Let me know what works for you. Cheers, Jamie",2024-09-08 08:15:00,Sent,Read,
2024090805678,echen@university.edu,Jamie_Wilson@mail.com,"Digital Marketing Workshop Insights","Hi Jamie, I hope you found the digital marketing workshop insightful. I'd love to hear your thoughts on how we can integrate some of the strategies into our course project. Best, Dr. Chen",2024-09-08 11:15:00,Received,Unread,
2024090802345,Jamie_Wilson@mail.com,sam.patel@startup.com,"Project Collaboration Update","Hi Sam, I wanted to update you on the progress of our business analytics project. We've made significant strides in data collection and are now focusing on analysis. Let's schedule a call to discuss the next steps. Best, Jamie",2024-09-08 12:45:00,Sent,Read,/documents/business_analytics_update.pdf
2024090806789,Jamie_Wilson@mail.com,studygroup@university.edu,"Spanish Practice Session","Hola amigos, I hope you're all ready for our Spanish practice session this afternoon. Let's meet in the library at 3:30 PM. Bring your flashcards and any questions you have. Hasta luego, Jamie",2024-09-08 14:00:00,Sent,Read,
2024090803456,artgallery@nyc.com,Jamie_Wilson@mail.com,"New Art Exhibit Invitation","Dear Jamie, We are excited to invite you to our latest art exhibit opening this evening. We hope you can join us to explore the diverse cultural expressions on display. Best regards, NYC Art Gallery",2024-09-08 16:00:00,Received,Unread,
2024090807890,Jamie_Wilson@mail.com,alex.rivera@example.com,"Guitar Jam Session","Hey Alex, I just learned some new chords and would love to have a jam session soon. Let me know when you're free to come over and play. Cheers, Jamie",2024-09-08 20:30:00,Sent,Read,
2024090804567,Jamie_Wilson@mail.com,bookclub@university.edu,"Science Fiction Book Discussion","Hi everyone, I'm looking forward to our discussion on the latest science fiction novel. Let's meet at the usual spot in the library at 9 PM. See you there! Best, Jamie",2024-09-08 21:00:00,Sent,Read,
2024090808901,technews@newsletter.com,Jamie_Wilson@mail.com,"Weekly Tech News Update","Dear Jamie, Here's your weekly update on the latest tech trends and innovations. We hope you find the articles insightful. Best, Tech News Team",2024-09-08 07:45:00,Received,Read,
2024090805679,Jamie_Wilson@mail.com,patagonia@store.com,"Inquiry About Sustainable Fashion","Hi Patagonia Team, I'm interested in learning more about your sustainable fashion line. Could you provide more details on the materials used and the production process? Thanks, Jamie",2024-09-08 18:00:00,Sent,Unread,
2024090806780,Jamie_Wilson@mail.com,dr.emily.chen@university.edu,"Follow-up on Workshop","Hi Dr. Chen, Thank you for the email. The workshop was indeed insightful. I have some ideas on how we can apply the strategies to our project. Let's discuss them during our next meeting. Best, Jamie",2024-09-08 19:30:00,Sent,Read,
2024090812345,sarah.lee@artenthusiasts.org,Jamie_Wilson@mail.com,"Tomorrow's Lunch Plans","Hi Jamie, I hope this message finds you well. I wanted to check if we have any plans set for after lunch tomorrow. I am looking forward to our meal and will make sure to be there on time. Please let me know if there are any specific arrangements or if you'd like to discuss anything further. Best regards, Sarah",2024-09-08 18:00:00,Sent,Unread,



2024090901234,Jamie_Wilson@mail.com,alex.rivera@example.com,"Catching Up Over Coffee","Hey Alex, Hope you're doing well! It's been a while since we caught up. How about grabbing coffee this weekend? Let me know what works for you. Cheers, Jamie",2024-09-09 08:45:00,Sent,Read,
2024090905678,echen@university.edu,Jamie_Wilson@mail.com,"Software Engineering Lecture Notes","Hi Jamie, Attached are the lecture notes from today's class. Let me know if you have any questions. Best, Dr. Chen",2024-09-09 10:45:00,Received,Unread,/documents/lecture_notes.pdf
