id,sender,receiver,subject,content,timestamp,status,read_status,attachments
2024090902345,Jamie_Wilson@mail.com,sam.patel@startup.com,"Tech Conference Opportunities","Hi Sam, I was researching some tech conferences and found a few that might be beneficial for networking and learning about emerging technologies. Let's discuss this further when you have time. Best, Jamie",2024-09-09 13:45:00,Sent,Read,
2024090906789,Jamie_Wilson@mail.com,bookclub@readers.com,"Book Club Meeting Recap","Hi everyone, Great discussion today on tech innovation! Looking forward to our next meeting. I've attached my notes for those interested. Best, Jamie",2024-09-09 15:45:00,Sent,Read,/documents/book_club_notes.pdf
2024090903456,sam.patel@startup.com,Jamie_Wilson@mail.com,"Re: Tech Conference Opportunities","Hi Jamie, Thanks for the info on the conferences. Let's chat tomorrow to go over which ones align best with our goals. Best, Sam",2024-09-09 16:15:00,Received,Unread,
2024090907890,Jamie_Wilson@mail.com,alex.rivera@example.com,"Re: Catching Up Over Coffee","Hey Alex, Saturday sounds perfect! Let's meet at our usual spot at 2 PM. Looking forward to it! Cheers, Jamie",2024-09-09 17:00:00,Sent,Read,
2024090904567,Jamie_Wilson@mail.com,family@wilson.com,"Weekly Family Update","Hi family, Just wanted to share some updates from my week. Classes are going well, and I'm exploring some exciting tech projects. Miss you all! Love, Jamie",2024-09-09 19:45:00,Sent,Read,
2024090908901,alex.rivera@example.com,Jamie_Wilson@mail.com,"Re: Catching Up Over Coffee","Hey Jamie, Coffee sounds great! How about Saturday afternoon? Let me know what time works for you. Cheers, Alex",2024-09-09 18:30:00,Received,Read,
2024090905679,Jamie_Wilson@mail.com,patagonia@store.com,"Inquiry About Sustainable Fashion","Hi Patagonia Team, I'm interested in learning more about your sustainable fashion line. Could you provide more details on your latest collection? Thanks, Jamie",2024-09-09 20:30:00,Sent,Unread,
2024090906780,echen@university.edu,Jamie_Wilson@mail.com,"Project Collaboration","Hi Jamie, I wanted to discuss a potential collaboration on a research project related to software engineering. Let me know if you're interested. Best, Dr. Chen",2024-09-09 21:00:00,Received,Unread,


