id,title,description,start_time,end_time,reminder
2024090112349,Counseling Sessions,"Conduct sessions focusing on mindfulness techniques and cognitive-behavioral strategies.",2024-09-01 13:00:00,2024-09-01 15:00:00,2024-09-01 12:30:00
2024090112350,Webinar on Psychological Counseling,"Attend a webinar on the latest research in psychological counseling.",2024-09-01 15:30:00,2024-09-01 16:30:00,2024-09-01 15:00:00
2024090212347,Group Therapy Session,"Host a group therapy session focusing on mindfulness techniques at the counseling center.",2024-09-02 12:00:00,2024-09-02 13:00:00,2024-09-02 11:30:00
2024090312348,Meeting with Colleague,"Discuss collaborative opportunities in community mental health at Green Leaf Café.",2024-09-03 12:00:00,2024-09-03 13:00:00,2024-09-03 11:30:00
2024090312350,Virtual Counseling Session,"Conduct a virtual counseling session focusing on mindfulness techniques.",2024-09-03 15:00:00,2024-09-03 17:00:00,2024-09-03 14:30:00
2024090412348,Therapy Sessions,"Conduct individual therapy sessions at the counseling center.",2024-09-04 13:00:00,2024-09-04 15:00:00,2024-09-04 12:30:00
2024090545678,Stress Management Workshop,"Facilitate a workshop on stress management techniques for corporate clients.",2024-09-05 12:00:00,2024-09-05 13:00:00,2024-09-05 11:30:00
2024090589012,Dinner Party,"Host a dinner party with friends at home featuring Mediterranean dishes.",2024-09-05 18:00:00,2024-09-05 19:30:00,2024-09-05 17:30:00
2024090612353,Online Course on Zen Philosophy,"Attend an online course on Zen philosophy and take notes.",2024-09-06 15:00:00,2024-09-06 16:30:00,2024-09-06 14:30:00
2024090612354,Virtual Book Club,"Participate in a virtual book club discussing classic literature.",2024-09-06 17:00:00,2024-09-06 18:00:00,2024-09-06 16:30:00
2024090712350,Family Therapy Session,"Conduct a family therapy session focusing on communication skills.",2024-09-07 12:00:00,2024-09-07 13:00:00,2024-09-07 11:30:00
2024090712353,Webinar on Technology in Counseling,"Attend a webinar on integrating technology in psychological counseling.",2024-09-07 14:00:00,2024-09-07 15:00:00,2024-09-07 13:30:00
2024090712355,Cultural Storytelling Event,"Attend a cultural storytelling event at a local community center.",2024-09-07 17:30:00,2024-09-07 18:30:00,2024-09-07 17:00:00
2024090812349,Mindfulness Seminar,"Lead a seminar on the benefits of mindfulness in everyday life at a local community center.",2024-09-08 12:00:00,2024-09-08 13:00:00,2024-09-08 11:30:00
2024090812354,Dinner with Friend,"Meet a close friend for dinner at a sustainable seafood restaurant.",2024-09-08 18:00:00,2024-09-08 19:30:00,2024-09-08 17:30:00
2024090912347,Virtual Counseling Session,"Conduct a virtual session focusing on mindfulness and stress reduction.",2024-09-09 12:00:00,2024-09-09 13:00:00,2024-09-09 11:30:00
2024090912349,Mindfulness Retreat Planning,"Attend a planning session for an upcoming mindfulness retreat.",2024-09-09 18:00:00,2024-09-09 19:00:00,2024-09-09 17:30:00
